{
  "contract": "bytedesk.renderer-qualification-evidence-tree/1",
  "schema": {
    "id": "https://schemas.bytedesk.ai/agent-delivery/v1/renderer-qualification-evidence-tree/1.0.0",
    "digest": "sha256:920aa69e3c43d949233d6e1e075bccf3930b2b3ffe7886fa38c3cd9247e79915"
  },
  "treeId": "native-linux-arm64-qualification-tree",
  "qualificationSelectionDigest": "sha256:0e422d71dca087747198072933959d87fab3a16d4a89a75b7e5cc00db1ca928d",
  "qualificationSuite": {
    "repository": "registry.example/product/qualification",
    "digest": "sha256:d6a0eb9b4bf89dc41450578ec1b45353e02bf34a8d054bedfb7dc582b46b0558",
    "mediaType": "application/vnd.bytedesk.agent.renderer-qualification-suite.v1+json",
    "size": 8405,
    "trustPolicy": {
      "id": "release-qualification-policy-v1",
      "digest": "sha256:a06d60512fb61f5e9aa1c9b5815a13ac122b29d0ae081d74b6fe95dec2bf5670"
    }
  },
  "attemptAuthorityDigest": "sha256:f591191a1cc176194772b918d103944212895d9b19fdad09dbaf7de81a5ea053",
  "platform": "linux/arm64",
  "executedDistribution": {
    "repository": "registry.example/product/renderers",
    "digest": "sha256:849479ca28d77084d4a9b627937fbe10e5976df6c6935adeb628bb7a6fc36242",
    "mediaType": "application/vnd.oci.image.manifest.v1+json",
    "size": 326,
    "trustPolicy": {
      "id": "product-release-v1",
      "digest": "sha256:a80850c38ad05f095146c0075910ced54b678a2975bb92611a83b810292de757"
    }
  },
  "collectorIdentityDigest": "sha256:b80b435b634128ddfd57fd486b51072fefa02710b6aaa0102d49390c2a7e7e9f",
  "leaves": [
    {
      "index": 0,
      "requirementId": "every-renderer-executable-compatibility",
      "role": "compatibility",
      "subjectRole": "renderer_executable",
      "subject": {
        "repository": "registry.example/product/renderers",
        "digest": "sha256:849479ca28d77084d4a9b627937fbe10e5976df6c6935adeb628bb7a6fc36242",
        "mediaType": "application/vnd.oci.image.manifest.v1+json",
        "size": 326,
        "trustPolicy": {
          "id": "product-release-v1",
          "digest": "sha256:a80850c38ad05f095146c0075910ced54b678a2975bb92611a83b810292de757"
        }
      },
      "details": {
        "repository": "registry.example/product/qualification-details",
        "digest": "sha256:b8626efce2dd7fa088b75fb67c2091b41906f1b1fbe13d6bb4d0999abc790fe2",
        "mediaType": "application/vnd.bytedesk.agent.release-qualification-details.v1+json",
        "size": 382,
        "trustPolicy": {
          "id": "release-qualification-evidence-v1",
          "digest": "sha256:85c3b7627c1c2d075f7f78dc274c8b9550a7ef773840c5a91a15a2d6f9620256"
        }
      },
      "result": "pass",
      "statementDigest": "sha256:3ee0d0acf8b214ef6d0ee5696e595be9785d2ee99a3bc30d6b74dfc1732a2e30",
      "producerSigningResult": {
        "contract": "bytedesk.signing-result/1",
        "schema": {
          "id": "https://schemas.bytedesk.ai/agent-delivery/v1/signing-result/1.0.0",
          "digest": "sha256:a64e23f1ae5a04e0c26c67085a41e8d0d70a9df9d45b1ec789c72c7634543ede"
        },
        "requestId": "sign-renderer-native-arm64-every-renderer-executable-compatibility-leaf",
        "requestDigest": "sha256:b5261ccec27ac83679b94882a20e44cd894ae44c9ceca2538d6be96d3ecfe5e3",
        "purpose": "release-qualification-evidence-v1",
        "keyVersion": "kms://product/release-qualification-evidence-v1/versions/1",
        "algorithm": "ECDSA_P256_SHA256",
        "publicKeyDigest": "sha256:80639d1cd23518517bd75136ab9ad00176ac230ca01a31ce8bfb95a2e991253c",
        "repository": "registry.example/product/qualification",
        "subjectDigest": "sha256:3ee0d0acf8b214ef6d0ee5696e595be9785d2ee99a3bc30d6b74dfc1732a2e30",
        "subjectMediaType": "application/vnd.bytedesk.agent.renderer-qualification-evidence-leaf-statement.v1+json",
        "signatureBundle": {
          "repository": "registry.example/product/qualification",
          "digest": "sha256:615b6ce8f92eb72bc40b9f2c1fbbd545347f4863011e1f5d4e85d5ce12766fbd",
          "mediaType": "application/vnd.dev.sigstore.bundle.v0.3+json",
          "size": 2371,
          "trustPolicy": {
            "id": "release-qualification-evidence-v1",
            "digest": "sha256:85c3b7627c1c2d075f7f78dc274c8b9550a7ef773840c5a91a15a2d6f9620256"
          }
        },
        "trustPolicy": {
          "id": "release-qualification-evidence-v1",
          "digest": "sha256:85c3b7627c1c2d075f7f78dc274c8b9550a7ef773840c5a91a15a2d6f9620256"
        },
        "providerAuditEvidence": {
          "repository": "registry.example/product/qualification",
          "digest": "sha256:8b8021ba5dfc90e3c21a0a4d4aac6bc35529a093d60f4a8b390b9f8e892a8718",
          "mediaType": "application/vnd.bytedesk.agent.signer-authentication-evidence.v1+json",
          "size": 1951,
          "trustPolicy": {
            "id": "release-qualification-evidence-v1",
            "digest": "sha256:85c3b7627c1c2d075f7f78dc274c8b9550a7ef773840c5a91a15a2d6f9620256"
          }
        },
        "signedAt": "2026-07-17T12:00:01Z"
      },
      "leafDigest": "sha256:6f68d87bf747f49910288e550baf28f8ecf6fa1b784b26df3b452d73bc34eddc"
    },
    {
      "index": 1,
      "requirementId": "every-renderer-executable-conformance",
      "role": "conformance",
      "subjectRole": "renderer_executable",
      "subject": {
        "repository": "registry.example/product/renderers",
        "digest": "sha256:849479ca28d77084d4a9b627937fbe10e5976df6c6935adeb628bb7a6fc36242",
        "mediaType": "application/vnd.oci.image.manifest.v1+json",
        "size": 326,
        "trustPolicy": {
          "id": "product-release-v1",
          "digest": "sha256:a80850c38ad05f095146c0075910ced54b678a2975bb92611a83b810292de757"
        }
      },
      "details": {
        "repository": "registry.example/product/qualification-details",
        "digest": "sha256:56f90203aac546975d95884c9d431a2f4c9a3d52bbc376c2309911ca8035da3d",
        "mediaType": "application/vnd.bytedesk.agent.release-qualification-details.v1+json",
        "size": 378,
        "trustPolicy": {
          "id": "release-qualification-evidence-v1",
          "digest": "sha256:85c3b7627c1c2d075f7f78dc274c8b9550a7ef773840c5a91a15a2d6f9620256"
        }
      },
      "result": "pass",
      "statementDigest": "sha256:093c9c983042db151c2ec5146f7fa3f1fda893ab86a40849589d0f42fbb7c9d5",
      "producerSigningResult": {
        "contract": "bytedesk.signing-result/1",
        "schema": {
          "id": "https://schemas.bytedesk.ai/agent-delivery/v1/signing-result/1.0.0",
          "digest": "sha256:a64e23f1ae5a04e0c26c67085a41e8d0d70a9df9d45b1ec789c72c7634543ede"
        },
        "requestId": "sign-renderer-native-arm64-every-renderer-executable-conformance-leaf",
        "requestDigest": "sha256:355d04cad1bb6495210997bbc13a7debb7983c61ce7ec9ddca63d61bc6a22e09",
        "purpose": "release-qualification-evidence-v1",
        "keyVersion": "kms://product/release-qualification-evidence-v1/versions/1",
        "algorithm": "ECDSA_P256_SHA256",
        "publicKeyDigest": "sha256:80639d1cd23518517bd75136ab9ad00176ac230ca01a31ce8bfb95a2e991253c",
        "repository": "registry.example/product/qualification",
        "subjectDigest": "sha256:093c9c983042db151c2ec5146f7fa3f1fda893ab86a40849589d0f42fbb7c9d5",
        "subjectMediaType": "application/vnd.bytedesk.agent.renderer-qualification-evidence-leaf-statement.v1+json",
        "signatureBundle": {
          "repository": "registry.example/product/qualification",
          "digest": "sha256:541b3a6525a240d8f7297881373e21a94dd36a47eab7e4d1168c7bebcbc7def8",
          "mediaType": "application/vnd.dev.sigstore.bundle.v0.3+json",
          "size": 2369,
          "trustPolicy": {
            "id": "release-qualification-evidence-v1",
            "digest": "sha256:85c3b7627c1c2d075f7f78dc274c8b9550a7ef773840c5a91a15a2d6f9620256"
          }
        },
        "trustPolicy": {
          "id": "release-qualification-evidence-v1",
          "digest": "sha256:85c3b7627c1c2d075f7f78dc274c8b9550a7ef773840c5a91a15a2d6f9620256"
        },
        "providerAuditEvidence": {
          "repository": "registry.example/product/qualification",
          "digest": "sha256:21601b3602deecd8f66d3731cf393dbb3b666924cb0ba48ec756a68e615bce3a",
          "mediaType": "application/vnd.bytedesk.agent.signer-authentication-evidence.v1+json",
          "size": 1945,
          "trustPolicy": {
            "id": "release-qualification-evidence-v1",
            "digest": "sha256:85c3b7627c1c2d075f7f78dc274c8b9550a7ef773840c5a91a15a2d6f9620256"
          }
        },
        "signedAt": "2026-07-17T12:00:01Z"
      },
      "leafDigest": "sha256:70a146a9ad4e692d3b12097f9e64ed479f8847b9dca42e7b81570c9778b30457"
    },
    {
      "index": 2,
      "requirementId": "every-renderer-executable-determinism",
      "role": "determinism",
      "subjectRole": "renderer_executable",
      "subject": {
        "repository": "registry.example/product/renderers",
        "digest": "sha256:849479ca28d77084d4a9b627937fbe10e5976df6c6935adeb628bb7a6fc36242",
        "mediaType": "application/vnd.oci.image.manifest.v1+json",
        "size": 326,
        "trustPolicy": {
          "id": "product-release-v1",
          "digest": "sha256:a80850c38ad05f095146c0075910ced54b678a2975bb92611a83b810292de757"
        }
      },
      "details": {
        "repository": "registry.example/product/qualification-details",
        "digest": "sha256:8fec19df20bbbe3d19f45677af4aaf39f0a1e8402cf04555424c5e22f66c6894",
        "mediaType": "application/vnd.bytedesk.agent.release-qualification-details.v1+json",
        "size": 378,
        "trustPolicy": {
          "id": "release-qualification-evidence-v1",
          "digest": "sha256:85c3b7627c1c2d075f7f78dc274c8b9550a7ef773840c5a91a15a2d6f9620256"
        }
      },
      "result": "pass",
      "statementDigest": "sha256:ea1c0f562251f42edc4e7f09de9f966c83f6c1ab56f9bb5e94f9295b53e72515",
      "producerSigningResult": {